{"grant_id":"11111111-1111-4111-8111-111111111111","provider":"clerk","provider_subject":"user_example123","internal_user_id":"22222222-2222-4222-8222-222222222222","identifier":"user@example.invalid","role":"tester","status":"active","created_at":"2026-09-02T00:00:00Z","updated_at":"2026-09-02T00:00:00Z","expires_at":null,"revoked_at":null,"revocation_reason":null,"revision":1}
